{
    "$schema": "http://json-schema.org/draft-07/schema#",
    "title": "GameMove",
    "type": "object",
    "required": ["game_id", "player", "card_played", "turn", "location"],
    "properties": {
      "move_id": {
        "type": "string",
        "description": "Unique move identifier"
      },
      "game_id": {
        "type": "string",
        "description": "Unique game identifier"
      },
      "player": {
        "type": "string",
        "enum": ["player1", "player2"],
        "description": "Which player made the move"
      },
      "turn": {
        "type": "integer",
        "minimum": 1,
        "description": "Turn in which the move was made"
      },
      "card_played": {
        "type": "string",
        "description": "Name of the played card"
      },
      "location": {
        "type": "object",
        "required": ["name", "position"],
        "properties": {
          "name": {
            "type": "string",
            "description": "Location name"
          },
          "position": {
            "type": "integer",
            "minimum": 1,
            "maximum": 3,
            "description": "Position of the location (1,2,3)"
          },
          "ally_cards": {
            "type": "array",
            "items": { "type": "string" },
            "description": "Other ally cards present in the location"
          },
          "enemy_cards": {
            "type": "array",
            "items": { "type": "string" },
            "description": "Enemy cards present in the location"
          }
        }
      }
    }
  }